language|Alert_definition|PT|Title|Content|Id|PublishedDate|LinkURI
en|"flood | ""ice jam"" + ""British Columbia"""|British Columbia|Moisture-laden system soaks parts of <b>B.C.</b>, up to 100 mm of rain possible - MSN|A potent system that has reached the <b>B.C.</b> coast will ramp up in intensity on Tuesday, bringing heavy downpours and gusty winds to the region&nbsp;...|tag:google.com,2013:googlealerts/feed:10191666313410400733|2023-10-10T06:27:20Z|https://www.msn.com/en-ca/weather/topstories/moisture-laden-system-soaks-parts-of-b-c-up-to-100-mm-of-rain-possible/ar-AA1hVxJ2
en|" flood | ""ice jam"" + ""Prince Edward Island"""|Prince Edward Island|Doggy paddler of the bay: Missing dog from Maine found on <b>island</b> in New Brunswick|If only Frankie could talk, he could fill in the details about his journey from the U.S. mainland to a Canadian <b>island</b>. Frankie went missing on&nbsp;...|tag:google.com,2013:googlealerts/feed:3600952195623644091|2023-10-10T15:55:01Z|https://atlantic.ctvnews.ca/doggy-paddler-of-the-bay-missing-dog-from-maine-found-on-island-in-new-brunswick-1.6595389
en|" flood | ""ice jam"" + ""Prince Edward Island"""|Prince Edward Island|"A new life for a historic church in Georgetown, <b>P.E.I.</b> | CBC.ca"|The former Holy Trinity Anglican Church was slated for demolition after falling into disrepair. Now the building is being restored, inside and out&nbsp;...|tag:google.com,2013:googlealerts/feed:15611610809899214104|2023-10-10T08:50:34Z|https://www.cbc.ca/player/play/2270277187873
en|" flood | ""ice jam"" + ""Prince Edward Island"""|Prince Edward Island|Reported peace officer impersonation was an off-duty police officer: RCMP - CTV Atlantic|Police say a reported impersonation of a peace officer in Cornwall, <b>P.E.I.</b>, was an off-duty RCMP constable in uniform returning home after shift.|tag:google.com,2013:googlealerts/feed:4125636561840028742|2023-10-10T02:37:30Z|https://atlantic.ctvnews.ca/mobile/reported-peace-officer-impersonation-was-an-off-duty-police-officer-rcmp-1.6594495
en|" flood | ""ice jam"" + Alberta"|Alberta|New associate chief justice for <b>Alberta</b> Court of King&#39;s Bench - Law360 Canada|... <b>Alberta</b>, as the new associate chief justice of the Court of King&#39;s Bench ... Queens University Law Dean Colleen <b>Flood</b> Law schools disclose common&nbsp;...|tag:google.com,2013:googlealerts/feed:10399103426711582528|2023-10-10T19:15:46Z|https://www.law360.ca/articles/51517/new-associate-chief-justice-for-alberta-court-of-king-s-bench
en|" flood | ""ice jam"" + Alberta"|Alberta|N.S. homeowners try to repair lingering <b>flood</b> damage, but say process is slow, overwhelming - CBC|N.S. homeowners try to repair lingering <b>flood</b> damage, but say process is slow, overwhelming ... Danielle Smith&#39;s big-money sales pitch on <b>Alberta</b>&nbsp;...|tag:google.com,2013:googlealerts/feed:12648653792138346672|2023-10-10T14:30:57Z|https://www.cbc.ca/news/canada/nova-scotia/n-s-homeowners-try-to-repair-lingering-flood-damage-but-say-process-is-slow-overwhelming-1.6989271
en|" flood | ""ice jam"" + Alberta"|Alberta|<b>Alberta</b> no longer has a human-wildlife conflict specialist. Some want that to change|<b>Alberta&#39;s</b> former human-wildlife conflict specialist is ... N.S. homeowners try to repair lingering <b>flood</b> damage, but say process is slow, overwhelming.|tag:google.com,2013:googlealerts/feed:7005644240161524232|2023-10-10T09:59:14Z|https://ca.sports.yahoo.com/news/alberta-no-longer-human-wildlife-234036529.html
en|" flood | ""ice jam"" + Ontario"|Ontario|Wartime housing solutions proposed in Hamilton&#39;s ongoing crisis - CHCH|... <b>flood</b> of returning soldiers in need of somewhere to live. Nearly 80 years ago the federal government&#39;s Wartime Housing Corporation launched a home&nbsp;...|tag:google.com,2013:googlealerts/feed:17049457485696541880|2023-10-11T07:16:13Z|https://www.chch.com/wartime-housing-solutions-proposed-in-hamiltons-ongoing-crisis/
en|" flood | ""ice jam"" + Ontario"|Ontario|RCMP launches investigation into <b>Ontario&#39;s</b> Greenbelt scandal - iHeartRadio.ca|The social media platform X, formerly known as Twitter, says it is trying to take action on a <b>flood</b> of posts sharing graphic media, violent speech and&nbsp;...|tag:google.com,2013:googlealerts/feed:14927082715131367507|2023-10-11T05:15:42Z|https://www.iheartradio.ca/am800/news/rcmp-launches-investigation-into-ontario-s-greenbelt-scandal-1.20351778
en|" flood | ""ice jam"" + Ontario"|Ontario|Millcroft Greenspace Alliance to Hold Province Accountable for Commitment to ... - Burlington Gazette|... floodplains by voiding a developer&#39;s application to build homes on zoned open space designated for <b>flood</b> protection in Burlington. At issue is an&nbsp;...|tag:google.com,2013:googlealerts/feed:7255792047043662963|2023-10-11T04:50:41Z|https://burlingtongazette.ca/millcroft-greenspace-alliance-to-hold-province-accountable-for-commitment-to-protect-homes-in-burlington/
en|" flood | ""ice jam"" + Ontario"|Ontario|Concerns raised over risk build-up poses to bridge - Otago Daily Times|Neil MacLeod lives in Mountain Rd and travels across the <b>Ontario</b> St bridge to get to Gore. ... If the gravel was not removed &quot;it would <b>flood</b> and take&nbsp;...|tag:google.com,2013:googlealerts/feed:16589479609668831377|2023-10-11T04:34:54Z|https://www.odt.co.nz/southland/the-ensign/concerns-raised-over-risk-build-poses-bridge
en|" flood | ""ice jam"" + Ontario"|Ontario|"Galveston at a pivotal time in <b>flood</b>-control planning | Editorials | The Daily News"|Galveston at a pivotal time in <b>flood</b>-control planning. By MICHAEL A ... <b>Ontario</b>, Canada, Prince Edward Island, Canada, Quebec, Canada, Saskatchewan&nbsp;...|tag:google.com,2013:googlealerts/feed:13916654611452068840|2023-10-11T04:21:45Z|https://www.galvnews.com/opinion/editorials/galveston-at-a-pivotal-time-in-flood-control-planning/article_92778afc-f715-515a-b030-ba163526630a.html
en|" flood | ""ice jam"" + Ontario"|Ontario|<b>Ontario</b> Govt Backs Mental Health Initiatives for Farmers - Mirage News|<b>Flood</b> repair road works underway in Western Downs. 11 Oct 2023 1:38 pm AEDT. Tasmanian Labor, Community Sector Tackle Living Cost Crisis. 11 Oct 2023&nbsp;...|tag:google.com,2013:googlealerts/feed:6086760137739635871|2023-10-11T03:05:25Z|https://www.miragenews.com/ontario-govt-backs-mental-health-initiatives-1100703/
en|" flood | ""ice jam"" + Ontario"|Ontario|Council votes unanimously to look into a Sault Hope&#39;s Cradle - SooToday.com|... <b>Flood</b>/SooToday. Listen to this article. 00:01:11. Sault Ste. Marie city ... Northern <b>Ontario</b> Business &middot; OntarioFlyers.ca &middot; OrilliaMatters.com&nbsp;...|tag:google.com,2013:googlealerts/feed:13495528747517362395|2023-10-11T03:01:02Z|https://www.sootoday.com/local-news/councillors-vote-unanimously-to-look-into-a-sault-hopes-cradle-7661287
en|" flood | ""ice jam"" + Ontario"|Ontario|"RCMP investigating <b>Ontario</b> plan to open up the Greenbelt | Townsville Bulletin"|Up Next &middot; Chicago doctor discusses summit celebrating women in medicine &middot; BIPOC Market at Union Depot in St. Paul &middot; Chicago weather: Flash <b>Flood</b> Advisory&nbsp;...|tag:google.com,2013:googlealerts/feed:9438429428238805088|2023-10-11T02:29:29Z|https://www.townsvillebulletin.com.au/news/world/rcmp-investigating-ontario-plan-to-open-up-the-greenbelt/video/5a734baf15ac8a8cbe297a08611bc78f
en|" flood | ""ice jam"" + Ontario"|Ontario|"Protecting mental health as images of vicious violence <b>flood</b> social media | CityNews Kitchener"|Protecting mental health as images of vicious violence <b>flood</b> social media ... <b>Ontario</b>. N2N 0B1 © 2006 - 2023 Rogers Media. All rights reserved.|tag:google.com,2013:googlealerts/feed:1319330883450098115|2023-10-11T02:13:40Z|https://kitchener.citynews.ca/2023/10/10/protecting-mental-health-as-images-of-vicious-violence-flood-social-media/
en|" flood | ""ice jam"" + Ontario"|Ontario|<b>Ontario</b> launches &#39;first-of-its-kind&#39; occupational exposure registry - Law360 Canada|<b>Ontario</b> is establishing an occupational exposure registry to track harmful ... Queens University Law Dean Colleen <b>Flood</b> Law schools disclose common&nbsp;...|tag:google.com,2013:googlealerts/feed:17720075120460196785|2023-10-11T01:59:25Z|https://www.law360.ca/articles/51524/ontario-launches-first-of-its-kind-occupational-exposure-registry
en|" flood | ""ice jam"" + Ontario"|Ontario|City Updates <b>Flood</b> Hazard Mitigation Projects - Fayette News|As part of the voluntary Community Rating System related to the ISO Rating for <b>Flood</b> Insurance, the City is required to update the City Council on&nbsp;...|tag:google.com,2013:googlealerts/feed:14815164602289943227|2023-10-11T01:18:19Z|https://www.fayette-news.net/news/city-updates-flood-hazard-mitigation-projects/article_ca172890-67d1-11ee-90b2-87e9bc5eb596.html
en|" flood | ""ice jam"" + Ontario"|Ontario|Canadian auto workers, GM reach tentative contract agreement, ending brief strike|... GM workers picketed Tuesday in ... Reporter Sean P. Murphy has what you need to know. Load Video. NOW PLAYING. Staying high and dry amidst <b>flood</b>&nbsp;...|tag:google.com,2013:googlealerts/feed:9868444455082375663|2023-10-11T01:12:51Z|https://www.bostonglobe.com/2023/10/10/business/canadian-auto-workers-gm-reach-tentative-contract-agreement-ending-brief-strike/
en|" flood | ""ice jam"" + Ontario"|Ontario|Cat lost by tearful widow in B.C. making safe Thanksgiving return to <b>Ontario</b> - Chemainus ...|... <b>Ontario</b> last month. (Photo submitted). BY GREG SAKAKI. A cat visiting ... <b>Flood</b> mitigation work&nbsp;...|tag:google.com,2013:googlealerts/feed:12973306257219551724|2023-10-10T21:40:24Z|https://www.chemainusvalleycourier.ca/trending-now/cat-lost-by-tearful-widow-in-bc-making-safe-thanksgiving-return-to-ontario-5559645
en|" flood | ""ice jam"" + Ontario"|Ontario|Google brings <b>Flood</b> Hub to the U.S. and Canada - Clayton News Daily|<b>Flood</b> Hub now covers more than 800 locations across North America near ... Sue S. <b>Ontario</b>, OH &middot; Foolproof Pie Crust &middot; Kathleen R. Kenosha, WI &middot; Pumpkin&nbsp;...|tag:google.com,2013:googlealerts/feed:10357874113227284208|2023-10-10T21:24:07Z|https://www.news-daily.com/arena/thestreet/google-brings-flood-hub-to-the-u-s-and-canada/article_d89d0009-948c-5614-bf38-aa6ed98dc78f.html
en|" flood | ""ice jam"" + Ontario"|Ontario|Google brings <b>Flood</b> Hub to the U.S. and Canada - Gwinnett Daily Post|Google brings <b>Flood</b> Hub to the U.S. and Canada. Tony Owusu; Oct 10, 2023 ... <b>Ontario</b>, OH &middot; Foolproof Pie Crust &middot; Kathleen R. Kenosha, WI &middot; Pumpkin&nbsp;...|tag:google.com,2013:googlealerts/feed:8073473625213913306|2023-10-10T21:19:01Z|https://www.gwinnettdailypost.com/arena/thestreet/google-brings-flood-hub-to-the-u-s-and-canada/article_1b850996-a083-50a8-bfc4-af1c0371e2bc.html
en|" flood | ""ice jam"" + Ontario"|Ontario|Watershed Conditions Statement (<b>Flood</b> Outlook) – Lake <b>Ontario</b> Storm Surge - October 10, 2023|Watershed Conditions Statement (<b>Flood</b> Outlook) – Lake <b>Ontario</b> Storm Surge – October 10, 2023. This is an early notice of the potential for&nbsp;...|tag:google.com,2013:googlealerts/feed:17909206668065655633|2023-10-10T20:43:55Z|https://conservationhamilton.ca/watershed-conditions-statement-flood-outlook-lake-ontario-storm-surge-october-10-2023/
en|" flood | ""ice jam"" + Ontario"|Ontario|Three Forks property owners to start get tax bills for new <b>flood</b> diversion canal - belgrade-news.com|... <b>flood</b> canal hasn&#39;t yet been built. The city decided to charge a flat fee per parcel within the <b>flood</b> district, Turner said, with an additional&nbsp;...|tag:google.com,2013:googlealerts/feed:9977872100022732195|2023-10-10T20:37:28Z|https://www.belgrade-news.com/news/three-forks-property-owners-to-start-get-tax-bills-for-new-flood-diversion-canal/article_b5513ac4-67a7-11ee-bf56-3b3a78183b6f.html
en|" flood | ""ice jam"" + Ontario"|Ontario|Canadian auto workers, GM reach tentative contract agreement less than 24 hours after strike began|New York City area under state of emergency after storms <b>flood</b> subways, strand people in cars ... Catharines, <b>Ontario</b>, and a parts distribution center&nbsp;...|tag:google.com,2013:googlealerts/feed:9930276373856885447|2023-10-10T20:17:16Z|https://www.ktvb.com/article/news/nation-world/canadian-auto-workers-gm-reach-tentative-contract-agreement/507-b9463d4a-41f4-4781-98e2-d3a9b0bd2887
en|" flood | ""ice jam"" + Ontario"|Ontario|N.S. homeowners try to repair lingering <b>flood</b> damage, but say process is slow, overwhelming - CBC|The July <b>flood</b> was the first time she ever needed to make an insurance ... <b>Ontario</b> woman wants mandatory signs on private beaches, after husband drowned&nbsp;...|tag:google.com,2013:googlealerts/feed:10097260244590665033|2023-10-10T20:14:00Z|https://www.cbc.ca/news/canada/nova-scotia/n-s-homeowners-try-to-repair-lingering-flood-damage-but-say-process-is-slow-overwhelming-1.6989271
en|" flood | ""ice jam"" + Ontario"|Ontario|Myanmar: Disruptions due to flooding ongoing across Bago Region and Mon State as of Oct. 10|Many roads and rail lines in the affected areas are impassable due to the floodwaters, including those connecting Yangon with the affected areas.|tag:google.com,2013:googlealerts/feed:2266300356388551612|2023-10-10T19:44:11Z|https://crisis24.garda.com/alerts/2023/10/myanmar-disruptions-due-to-flooding-ongoing-across-bago-region-and-mon-state-as-of-oct-10
en|" flood | ""ice jam"" + Saskatchewan"|Saskatchewan|Ottawa names new chief justice of <b>Saskatchewan</b> - Law360 Canada|... <b>Saskatchewan</b>, has been appointed as the new chief justice of <b>Saskatchewan</b> ... Queens University Law Dean Colleen <b>Flood</b> Law schools disclose common&nbsp;...|tag:google.com,2013:googlealerts/feed:14502384298381885896|2023-10-11T00:19:01Z|https://www.law360.ca/articles/51516/ottawa-names-new-chief-justice-of-saskatchewan
en|" flood | ""ice jam"" + Saskatchewan"|Saskatchewan|Opinion: If it&#39;s easy to override the Charter, then what&#39;s protecting Canadians&#39; rights?|<b>Saskatchewan&#39;s</b> hasty deployment of the notwithstanding clause is the ... <b>Flood</b> relief? Declaration of war? Close: it was to pass a law requiring&nbsp;...|tag:google.com,2013:googlealerts/feed:5341138799362152959|2023-10-11T00:09:44Z|https://www.theglobeandmail.com/opinion/article-if-its-easy-to-override-the-charter-then-whats-protecting-canadians/
en|" flood | ""ice jam"" + Saskatchewan"|Saskatchewan|City releases powerful new anti-racism video featuring <b>Saskatchewan</b> athletes|On Saturday, Oct. 7, the City of Saskatoon launched a new anti-racism video in partnership with the City of Regina at the <b>Saskatchewan</b> Roughriders&nbsp;...|tag:google.com,2013:googlealerts/feed:177946658007822956|2023-10-10T18:06:51Z|https://www.saskatoon.ca/news-releases/city-releases-powerful-new-anti-racism-video-featuring-saskatchewan-athletes
en|" flood | ""ice jam"" + Saskatchewan"|Saskatchewan|"Why a <b>flood</b> prevention plan for Rennie&#39;s River is jammed up | CBC.ca"|Recommended for You &middot; &#39;Queen of Canada&#39; cult threatens <b>Sask</b>. &middot; Grizzly chases herd of bighorn sheep in Kananaskis &middot; Woman living in tent wonders what she&nbsp;...|tag:google.com,2013:googlealerts/feed:12923952502772679117|2023-10-10T18:01:14Z|https://www.cbc.ca/player/play/2271202883795
en|" flood | ""ice jam"" + Saskatchewan"|Saskatchewan|N.S. homeowners try to repair lingering <b>flood</b> damage, but say process is slow, overwhelming - CBC|N.S. homeowners try to repair lingering <b>flood</b> damage, but say process is slow, overwhelming ... News -Canada -<b>Saskatchewan</b>. Cult of self-proclaimed&nbsp;...|tag:google.com,2013:googlealerts/feed:3446314105851138543|2023-10-10T15:56:37Z|https://www.cbc.ca/news/canada/nova-scotia/n-s-homeowners-try-to-repair-lingering-flood-damage-but-say-process-is-slow-overwhelming-1.6989271
en|" flood | ""ice jam"" + Saskatchewan"|Saskatchewan|Paintings of Indigenous ways of life in a northern <b>Saskatchewan</b> hamlet return home|... <b>Saskatchewan</b> hamlet with an impressive art collection ... N.S. homeowners try to repair lingering <b>flood</b> damage, but say process is slow, overwhelming.|tag:google.com,2013:googlealerts/feed:7561939288892010355|2023-10-10T09:35:05Z|https://ca.news.yahoo.com/paintings-indigenous-ways-life-northern-214422502.html
fr|" inondation | embacle + ""Nouveau Brunswick"""|Nouveau-Brunswick|Élections <b>Nouveau</b>-<b>Brunswick</b> : les partis d&#39;opposition sont prêts - CIMT-CHAU|Élections <b>Nouveau</b>-<b>Brunswick</b> : les partis d&#39;opposition sont prêts. Publié le ... <b>inondations</b> et des bris aux quatre coins de la région d... Voir plus.|tag:google.com,2013:googlealerts/feed:8003255355396674374|2023-10-10T18:32:02Z|https://cimtchau.ca/nouvelles/elections-nouveau-brunswick-les-partis-dopposition-sont-prets/
fr|" inondation | embacle + Québec"|Québec|<b>Inondations</b> : Soupir de soulagement à Petit-Saguenay - TVA Nouvelles|Leur résidence était menacée d&#39;une <b>inondation</b>. «Il y a toujours un ... Alexandre Lachance: l&#39;entreprise de l&#39;influenceur millionnaire radiée au <b>Québec</b>.|tag:google.com,2013:googlealerts/feed:1594255685797702806|2023-10-11T03:10:51Z|https://www.tvanouvelles.ca/2023/10/10/inondations--soupir-de-soulagement-a-petit-saguenay
fr|" inondation | embacle + Québec"|Québec|La rivière du Gouffre sera nettoyée de ses débris - Le Charlevoisien|... <b>inondations</b> (PRAFI) du gouvernement du <b>Québec</b>, ce qui représente 75 % de la facture de 384 434 $. La Municipalité puiser la somme de 96 108 $ dans&nbsp;...|tag:google.com,2013:googlealerts/feed:2550149282846176532|2023-10-11T02:04:33Z|https://www.lecharlevoisien.com/2023/10/10/la-riviere-du-gouffre-sera-nettoyee-de-ses-debris/
fr|" inondation | embacle + Québec"|Québec|Saint-Élie-de-Caxton : une rivière se forme sur leur terrain et détruit tout - Radio-Canada|<b>Inondations</b> en Mauricie : 50 résidents ont été évacuée par bateau. Un ... Elle espère que <b>Québec</b> fournira une aide financière. Publicité. L&#39;équipe&nbsp;...|tag:google.com,2013:googlealerts/feed:3512061354700455201|2023-10-10T22:54:31Z|https://ici.radio-canada.ca/nouvelle/2016680/destruction-terrain-pluie-inondations-maskinonge
fr|" inondation | embacle + Québec"|Québec|"<b>Inondations</b> : Saint-Élie-de-Caxton demande l&#39;aide de <b>Québec</b> | TVA Nouvelles"|Saint-Élie-de-Caxton espère avoir de l&#39;aide financière du gouvernement du <b>Québec</b> rapidement pour éviter que les installations temporaires ne&nbsp;...|tag:google.com,2013:googlealerts/feed:13325632769891467482|2023-10-10T22:50:47Z|https://www.tvanouvelles.ca/2023/10/10/inondations--saint-elie-de-caxton-demande-laide-de-quebec
fr|" inondation | embacle + Québec"|Québec|<b>Inondations</b>: l&#39;aide financière arrivera rapidement - Le Nouvelliste|Le gouvernement du <b>Québec</b> ne devrait pas tarder à rendre disponible l&#39;argent servant à soutenir les municipalités et les citoyens victimes des&nbsp;...|tag:google.com,2013:googlealerts/feed:4923833403280904360|2023-10-10T22:21:15Z|https://www.lenouvelliste.ca/actualites/actualites-locales/2023/10/10/inondations-laide-financiere-arrivera-rapidement-5HZBEZJW5BHNBOKMJNTW3MAWDY/
fr|" inondation | embacle + Québec"|Québec|Forts vents : un voilier coule dans les eaux du lac Témiscouata - Ciel Fm|Des milliers de clients d&#39;Hydro-<b>Québec</b> ont été plongés dans le noir. Dans certains cas, les pannes ont duré pendant plus de 24 heures. Des <b>inondations</b>&nbsp;...|tag:google.com,2013:googlealerts/feed:13261909042933606664|2023-10-10T21:44:34Z|https://www.ciel103.com/nouvelle/6360-forts-vents-un-voilier-coule-dans-les-eaux-du-lac-temiscouata
fr|" inondation | embacle + Québec"|Québec|<b>Inondations</b> en Birmanie: environ 14 000 personnes déplacées - TVA Nouvelles|En collaboration avec nos partenaires &middot; Les Fermes Burnbrae : fiers partenaires des producteurs d&#39;oeufs <b>québécois</b> &middot; Prix Nobilis : l&#39;excellence des&nbsp;...|tag:google.com,2013:googlealerts/feed:2153743781541077098|2023-10-10T21:43:23Z|https://www.tvanouvelles.ca/2023/10/10/inondations-en-birmanie-environ-14-000-personnes-deplacees
fr|" inondation | embacle + Québec"|Québec|L&#39;heure est aux réparations en Mauricie après les pluies diluviennes de la fin de semaine|La municipalité de Saint-Mathieu-du-Parc a été lourdement touchée et demande à <b>Québec</b> le statut de municipalité sinistrée. ... <b>Inondations</b> en Mauricie :&nbsp;...|tag:google.com,2013:googlealerts/feed:17483792903677727250|2023-10-10T21:14:13Z|https://ici.radio-canada.ca/nouvelle/2016590/reparations-mrc-mekinac-maskinonge-pluies
fr|" inondation | embacle + Québec"|Québec|"Une première rue éponge pour tenter de réduire les risques d&#39;<b>inondations</b> | La Presse"|<b>Québec</b> et Canada &middot; États-Unis &middot; Europe &middot; Asie &middot; Amérique latine &middot; Caraïbes ... La rue éponge améliorera-t-elle la situation des citoyens confrontés à&nbsp;...|tag:google.com,2013:googlealerts/feed:11048748059362636071|2023-10-10T21:04:06Z|https://www.lapresse.ca/actualites/grand-montreal/2023-10-10/une-premiere-rue-eponge-pour-tenter-de-reduire-les-risques-d-inondations.php
fr|" inondation | embacle + Québec"|Québec|Centre-du-<b>Québec</b>: un suspect arrêté pour des vols dans les véhicules - Le Nouvelliste|Centre-du-<b>Québec</b>: un suspect arrêté pour des vols dans les véhicules. Par ... <b>Inondations</b>: «Ça va prendre de l&#39;aide du gouvernement» &middot; Actualités&nbsp;...|tag:google.com,2013:googlealerts/feed:14336257212163064059|2023-10-10T20:20:35Z|https://www.lenouvelliste.ca/actualites/justice-et-faits-divers/2023/10/10/centre-du-quebec-un-suspect-arrete-pour-des-vols-dans-les-vehicules-W2HPTJTSYZA3FOPLVVHDTALGU4/
fr|" inondation | embacle + Québec"|Québec|Après les pluies diluviennes, l&#39;heure est au bilan à Saint-Ours - SorelTracy Magazine|Il ne faut pas oublier les gens d&#39;Hydro-<b>Québec</b>, la Sûreté du <b>Québec</b>, le ... (Voir texte :https://www.soreltracy.com/<b>inondation</b>-glissement-de&nbsp;...|tag:google.com,2013:googlealerts/feed:17626545076841774198|2023-10-10T17:22:03Z|https://www.soreltracy.com/apres-les-pluies-diluviennes-lheure-est-au-bilan-a-saint-ours/
fr|" inondation | embacle + Québec"|Québec|"Birmanie | Environ 14 000 personnes déplacées en raison d&#39;<b>inondations</b> | La Presse"|Je ne m&#39;attendais pas à voir autant d&#39;eau ici » : en Birmanie, des <b>inondations</b> ... <b>Québec</b> et Canada &middot; États-Unis &middot; Europe &middot; Asie &middot; Amérique latine&nbsp;...|tag:google.com,2013:googlealerts/feed:15926970889953181501|2023-10-10T17:12:41Z|https://www.lapresse.ca/international/asie-et-oceanie/2023-10-10/birmanie/environ-14-000-personnes-deplacees-en-raison-d-inondations.php
fr|" inondation | embacle + Québec"|Québec|"Mes chevaux et ma chèvre «auraient été immergés», témoigne un citoyen | JDQ"|Suite aux pluies diluviennes qui ont frappé le <b>Québec</b> en fin de semaine, André Corbeil, un résident de Lavaltrie , a été complètement <b>inondé</b>.|tag:google.com,2013:googlealerts/feed:6415688862720874085|2023-10-10T17:10:20Z|https://www.journaldequebec.com/2023/10/10/mes-chevaux-et-ma-chevre-auraient-ete-immerges-temoigne-un-citoyen
fr|" inondation | embacle + Québec"|Québec|Pluie à Petit-Saguenay: retour à la normale - CKAJ|... <b>inondation</b> majeure, alors que ce seuil n&#39;avait été atteint que deux ... Jour de l&#39;Action de grâce au <b>Québec</b>: ouvert ou fermé ? 7 octobre, 2023.|tag:google.com,2013:googlealerts/feed:8029822375998039965|2023-10-10T13:37:54Z|https://ckaj.org/pluie-a-petit-saguenay-retour-a-la-normale/
fr|" inondation | embacle + Québec"|Québec|Slovénie: un maire veut démolir son village pour l&#39;adapter aux changements climatiques|Sous le choc des <b>inondations</b> qui ont dévasté la Slovénie cet été, un maire a décidé d&#39;opter pour une méthode radicale.|tag:google.com,2013:googlealerts/feed:2027049053901299141|2023-10-10T12:51:22Z|https://www.journaldequebec.com/2023/10/10/slovenie-un-maire-veut-demolir-son-village-pour-ladapter-aux-changements-climatiques
fr|" inondation | embacle + Québec"|Québec|"Saint-Mathieu-du-Parc s&#39;attend à être déclaré municipalité sinistrée | Radio-Canada.ca"|<b>Inondations</b> en Mauricie : 50 résidents ont été évacués par bateau &middot; Les ... Le campus de <b>Québec</b> du Cégep Limoilou en automne. Enseignement&nbsp;...|tag:google.com,2013:googlealerts/feed:12721432589515581835|2023-10-10T11:47:19Z|https://ici.radio-canada.ca/nouvelle/2016470/saint-mathieu-parc-aide-inondations
fr|" inondation | embacle + Québec"|Québec|Effondrement des berges du lac Bell et du camping Bivouak, à Saint-Élie-de-Caxton|<b>Inondations</b> en Mauricie : une évacuation par bateau est envisagée pour 50 résidents ... Le campus de <b>Québec</b> du Cégep Limoilou en automne. Enseignement&nbsp;...|tag:google.com,2013:googlealerts/feed:3230131989514804356|2023-10-10T11:29:13Z|https://ici.radio-canada.ca/nouvelle/2016427/camping-bivouak-saint-elie-caxton
