language|Alert_definition|PT|Title|Content|Id|PublishedDate|LinkURI
fr|"inondation | embacle + Ontario"|Ontario|"Les résidents coincés au lac Jackson s&#39;impatientent | Radio-Canada.ca"|Nord de l&#39;<b>Ontario</b> &middot; Nouveau-Brunswick &middot; Nouvelle-Écosse &middot; Ottawa &middot; Québec &middot; Saguenay–Lac-Saint-Jean &middot; Saskatchewan &middot; Terre-Neuve-et-Labrador &middot; Toronto&nbsp;...|tag:google.com,2013:googlealerts/feed:775942317702143044|2023-10-16T22:00:47Z|https://ici.radio-canada.ca/nouvelle/2018262/lac-jackson-inondation-saint-mathieu
fr|" inondation | embacle + Québec"|Québec|"Régis et Christopher Lavoie honorés pour leur sacrifice | Le Charlevoisien"|La mémoire des pompiers de Saint-Urbain Régis Lavoie et Christopher Lavoie, décédés lors des <b>inondations</b> ... <b>Québec</b>. Son collègue ministre responsable&nbsp;...|tag:google.com,2013:googlealerts/feed:6574177467187818041|2023-10-16T15:00:50Z|https://www.lecharlevoisien.com/2023/10/16/regis-et-christopher-lavoie-honores-pour-leur-sacrifice/
fr|" inondation | embacle + Québec"|Québec|"Les résidents coincés au lac Jackson s&#39;impatientent | Radio-Canada.ca"|Les attentes envers le gouvernement du <b>Québec</b> sont grandes de la part du maire Guy Marcotte qui souhaite qu&#39;il assume la totalité de la facture.|tag:google.com,2013:googlealerts/feed:841824760970388724|2023-10-16T13:16:39Z|https://ici.radio-canada.ca/nouvelle/2018262/lac-jackson-inondation-saint-mathieu
en|" flood | ""ice jam"" + ""Nova Scotia"""|Nova Scotia|More rain to come as warnings continue for Eastern <b>Nova Scotia</b>|Rainfall warnings calling for totals up to or in excess of 80 mm continue Monday afternoon in <b>Nova Scotia</b> for Cape Breton as well as Pictou,&nbsp;...|tag:google.com,2013:googlealerts/feed:17965467300374887441|2023-10-16T17:31:34Z|https://atlantic.ctvnews.ca/more/more-rain-to-come-as-warnings-continue-for-eastern-nova-scotia-1.6603165
en|" flood | ""ice jam"" + ""Nova Scotia"""|Nova Scotia|GUEST COLUMN: How climate change threatens development - MidlandToday.ca|In the Nottawasaga watershed, this starts with ensuring development is not built in <b>floodplains</b> and other spaces that are prone to flooding and&nbsp;...|tag:google.com,2013:googlealerts/feed:3102971775419270576|2023-10-16T17:04:23Z|https://www.midlandtoday.ca/local-news/guest-column-how-climate-change-threatens-development-7687533
en|" flood | ""ice jam"" + ""Nova Scotia"""|Nova Scotia|Globe Climate: We are digging deep on critical minerals|Green Investing. Halifax business owner still knee-deep in insurance red tape after summer <b>flood</b>. <b>Nova Scotia</b> continues to count the costs after&nbsp;...|tag:google.com,2013:googlealerts/feed:774357603705775230|2023-10-16T17:01:12Z|https://www.theglobeandmail.com/canada/article-globe-climate-we-are-digging-deep-on-critical-minerals/
en|" flood | ""ice jam"" + ""Nova Scotia"""|Nova Scotia|Disposal pits used for Fiona debris closing at the end of the month - CTV News Atlantic|<b>Nova Scotia</b> &middot; New Brunswick &middot; Prince Edward Island. Video. Latest Video &middot; CTV News ... Man loses trailer home after <b>N.S. flood</b>. 12. <b>N.S.</b> woman goes&nbsp;...|tag:google.com,2013:googlealerts/feed:14997215966193292417|2023-10-16T16:03:02Z|https://atlantic.ctvnews.ca/disposal-pits-used-for-fiona-debris-closing-at-the-end-of-the-month-1.6603103
en|" flood | ""ice jam"" + ""Nova Scotia"""|Nova Scotia|Flooding on the docket at Essex town council|A Torbrook, <b>N.S.</b>, man is facing multiple charges, including arson, after he allegedly tried to burn a home on Sunday. Winnipeg police on scene in West&nbsp;...|tag:google.com,2013:googlealerts/feed:17514395162704622538|2023-10-16T14:16:18Z|https://www.iheartradio.ca/ctv-news-content/flooding-on-the-docket-at-essex-town-council-1.20370233
en|" flood | ""ice jam"" + ""Nova Scotia"""|Nova Scotia|<b>N.S.</b> man charged with arson after allegedly trying to burn home - CTV Atlantic|A Torbrook, <b>N.S.</b>, man is facing multiple charges, including arson, after he allegedly tried to burn a home on Sunday.|tag:google.com,2013:googlealerts/feed:546574227110391601|2023-10-16T14:02:01Z|https://atlantic.ctvnews.ca/mobile/more/n-s-man-charged-with-arson-after-allegedly-trying-to-burn-home-1.6602956
en|" flood | ""ice jam"" + ""Nova Scotia"""|Nova Scotia|CIVIL PROCEDURE - Appeals - Appeal as of right - Quashing or dismissal of - Courts|Motion by College of Paramedics of <b>Nova Scotia</b> (College) for dismissal of ... Queens University Law Dean Colleen <b>Flood</b> Law schools disclose common&nbsp;...|tag:google.com,2013:googlealerts/feed:12111999313785312692|2023-10-16T12:35:15Z|https://www.law360.ca/articles/51673/civil-procedure-appeals-appeal-as-of-right-quashing-or-dismissal-of-courts-jurisdiction
en|"flood | ""ice jam"" + ""British Columbia"""|British Columbia|<b>B.C.</b>&#39;s South Coast in for a soaking as season&#39;s first atmospheric river arrives - Global News|... <b>flood</b> risk&#39;. 5:39 Heavy rain after summer drought raises <b>flood</b> risk. Trending Now. Gaza hospital bombing reports are &#39;unacceptable,&#39; Trudeau says.|tag:google.com,2013:googlealerts/feed:7363665761611582313|2023-10-18T02:31:58Z|https://globalnews.ca/news/10032096/bc-south-coast-weather-rain-storm/
en|"flood | ""ice jam"" + ""British Columbia"""|British Columbia|<b>Flood</b>, power outage risk rises in <b>B.C.</b> as potent fall storm pushes in - MSN|A potent fall storm will lash the <b>B.C.</b> coast with extreme rainfall and potentially damaging wind gusts. The significant storm is being bolstered&nbsp;...|tag:google.com,2013:googlealerts/feed:11955838811651306192|2023-10-18T02:06:45Z|https://www.msn.com/en-ca/weather/topstories/flood-power-outage-risk-rises-in-b-c-as-potent-fall-storm-pushes-in/ar-AA1im4RY
en|"flood | ""ice jam"" + ""British Columbia"""|British Columbia|OP/ED: Low Arrow Lakes levels underscore need for modernized treaty - Trail Times|... <b>flood</b> protection and, in the case of this summer, power-generation ... PODCAST: Colin Mochrie of &#39;Whose Line&#39; brings HYPROV to <b>B.C.</b> &middot; Meet Walter,&nbsp;...|tag:google.com,2013:googlealerts/feed:10161606063708565438|2023-10-18T02:02:02Z|https://www.trailtimes.ca/opinion/oped-low-arrow-lakes-levels-underscore-need-for-modernized-treaty-5933947
en|"flood | ""ice jam"" + ""British Columbia"""|British Columbia|"<b>British Columbians</b> advised to prepare for fall storms, heavy rain | <b>BC</b> Gov News"|Stay well away and keep young children and pets away from the banks of fast-flowing streams and flooded areas or bridges. Do not drive through <b>flood</b>&nbsp;...|tag:google.com,2013:googlealerts/feed:11110039095082388979|2023-10-18T01:31:43Z|https://news.gov.bc.ca/releases/2023EMCR0067-001609
en|"flood | ""ice jam"" + ""British Columbia"""|British Columbia|<b>Flood</b>, power outage risk rises in <b>B.C.</b> as potent fall storm pushes in - The Weather Network|The remnants of Typhoon Bolaven continues to track across the Pacific Ocean and has helped set up the pattern for a strong atmospheric river&nbsp;...|tag:google.com,2013:googlealerts/feed:11884927249342549387|2023-10-18T01:03:46Z|https://www.theweathernetwork.com/en/news/weather/forecasts/british-columbias-wettest-storm-of-the-year-threatens-300-mm-of-rain-this-week
en|"flood | ""ice jam"" + ""British Columbia"""|British Columbia|Owners of destroyed Chilliwack properties still waiting for help 2 years after historic flooding|Federal government to invest more than $500M in <b>B.C. flood</b> recovery. &quot;They fall through the cracks — they don&#39;t qualify for DFA,&quot; said Patti&nbsp;...|tag:google.com,2013:googlealerts/feed:9142388757269912433|2023-10-17T23:32:46Z|https://www.cbc.ca/news/canada/british-columbia/chilliwack-flooding-residents-wait-for-help-1.6999347
en|"flood | ""ice jam"" + ""British Columbia"""|British Columbia|Canada, U.S., wrap up 19th round of <b>Columbia</b> River Treaty talks - The Free Press|... <b>flood</b> control management and power generation on the Columbia River. The treaty led to the construction of three dams in <b>British Columbia</b> and one&nbsp;...|tag:google.com,2013:googlealerts/feed:15122747604949922802|2023-10-17T23:00:37Z|https://www.thefreepress.ca/news/canada-us-wrap-up-19th-round-of-columbia-river-treaty-talks-5934025
en|"flood | ""ice jam"" + ""British Columbia"""|British Columbia|<b>B.C.</b> proposing police transition law, hit with legal challenge over process in Surrey|<b>British Columbia</b> is updating its Police Act to clarify the process a ... Queens University Law Dean Colleen <b>Flood</b> Law schools disclose common&nbsp;...|tag:google.com,2013:googlealerts/feed:5888690214520713940|2023-10-17T22:58:27Z|https://www.law360.ca/articles/51713/b-c-proposing-police-transition-law-hit-with-legal-challenge-over-process-in-surrey
en|"flood | ""ice jam"" + ""British Columbia"""|British Columbia|"Heavy rain deluges <b>BC</b> coast, bringing potential for low-lying flooding | Canada.Com"|A year later, farm <b>flood</b> recovery still a work in progress in <b>B.C.</b>&#39;s Sumas Prairie &middot; A University of <b>British Columbia</b> researcher is calling for a&nbsp;...|tag:google.com,2013:googlealerts/feed:14823966024934214055|2023-10-17T18:02:01Z|https://o.canada.com/news/local-news/heavy-rain-deluges-bc-coast-bringing-potential-for-low-lying-flooding
en|"flood | ""ice jam"" + ""British Columbia"""|British Columbia|<b>B.C.</b> increases regulations for short-term rentals to reduce impact on housing market|<b>British Columbia</b> has introduced legislation aimed at reducing the impact ... Queens University Law Dean Colleen <b>Flood</b> Law schools disclose common&nbsp;...|tag:google.com,2013:googlealerts/feed:13916910553589624669|2023-10-17T17:09:48Z|https://www.law360.ca/articles/51715/b-c-increases-regulations-for-short-term-rentals-to-reduce-impact-on-housing-market
en|" flood | ""ice jam"" + ""Newfoundland and Labrador"""|Newfoundland and Labrador|Newly elected Tory Opposition leader in <b>N.L.</b> says people should pay less tax|Tony Wakeham spent his day in the <b>Newfoundland and Labrador</b> house of assembly sitting across from Liberal Premier Andrew Furey as the newly&nbsp;...|tag:google.com,2013:googlealerts/feed:157105938622757998|2023-10-17T11:35:08Z|https://atlantic.ctvnews.ca/newly-elected-tory-opposition-leader-in-n-l-says-people-should-pay-less-tax-1.6604055
en|" flood | ""ice jam"" + ""Prince Edward Island"""|Prince Edward Island|&#39;Overwhelmingly confusing&#39;: Mixed reviews from wildfire victims to HRM report - CTV News Atlantic|“We&#39;re the size of <b>Prince Edward Island</b>, it&#39;s time to resource emergency service and emergency management adequately. ... Man loses trailer home after&nbsp;...|tag:google.com,2013:googlealerts/feed:14279160304877026139|2023-10-17T11:47:25Z|https://atlantic.ctvnews.ca/overwhelmingly-confusing-mixed-reviews-from-wildfire-victims-to-hrm-report-1.6604035
en|" flood | ""ice jam"" + ""Prince Edward Island"""|Prince Edward Island|More rain to come as warnings continue for Eastern Nova Scotia - CTV Atlantic|Special weather statements extend into Kings and Queens Counties, <b>Prince Edward Island</b>. ... Man loses trailer home after N.S. <b>flood</b>. 12. N.S. woman goes&nbsp;...|tag:google.com,2013:googlealerts/feed:8603727484436937458|2023-10-17T03:00:46Z|https://atlantic.ctvnews.ca/more/more-rain-to-come-as-warnings-continue-for-eastern-nova-scotia-1.6603165
en|" flood | ""ice jam"" + Alberta"|Alberta|<b>Alberta</b> sheriffs shutter &#39;problem property&#39; in southeast Calgary over alleged criminal activity - MSN|<b>Alberta</b> sheriffs shutter &#39;problem property&#39; in southeast Calgary over alleged criminal activity ... <b>flood</b> threat as spiraling system brings days of rain&nbsp;...|tag:google.com,2013:googlealerts/feed:7144116115361430441|2023-10-18T02:25:54Z|https://www.msn.com/en-ca/news/other/alberta-sheriffs-shutter-problem-property-in-southeast-calgary-over-alleged-criminal-activity/ar-AA1inZ2D
en|" flood | ""ice jam"" + Alberta"|Alberta|90 cats admitted to Ottawa Humane Society in under a week - iHeartRadio|OHS says the &quot;<b>flood</b> of felines&quot; is creating additional strain on the shelter&#39;s resources. ... Central <b>Alberta</b> Soccer Association president suspended&nbsp;...|tag:google.com,2013:googlealerts/feed:718524733414260889|2023-10-17T22:23:40Z|https://www.iheartradio.ca/ctv-news-content/90-cats-admitted-to-ottawa-humane-society-in-under-a-week-1.20375004
en|" flood | ""ice jam"" + Alberta"|Alberta|Public inquiry needed to examine <b>Alberta&#39;s</b> &#39;mishandling&#39; of inactive and orphan wells|Queens University Law Dean Colleen <b>Flood</b> Law schools disclose common concerns, diverse takes on regulating GenAI use by students, faculty. Latest.|tag:google.com,2013:googlealerts/feed:3824557401126771019|2023-10-17T19:53:48Z|https://www.law360.ca/articles/51718/public-inquiry-needed-to-examine-alberta-s-mishandling-of-inactive-and-orphan-wells-report
en|" flood | ""ice jam"" + Alberta"|Alberta|Beyond The Standard Form: The <b>Alberta</b> Court Of Appeal Confirms Insurable Interest Arises ...|In insurance coverage determinations, the question of causation is generally the starting point. Did the house <b>flood</b> because of heavy rainfall or a&nbsp;...|tag:google.com,2013:googlealerts/feed:2165729384896189011|2023-10-17T18:13:51Z|https://www.mondaq.com/canada/insurance-laws-and-products/1378082/beyond-the-standard-form-the-alberta-court-of-appeal-confirms-insurable-interest-arises-from-special-relationship
en|" flood | ""ice jam"" + Alberta"|Alberta|Fasken opens office in <b>Alberta</b> First Nation&#39;s new development - Law360 Canada|Featured. Queens University Law Dean Colleen <b>Flood</b> Law schools disclose common concerns, diverse takes on regulating GenAI use by students, faculty&nbsp;...|tag:google.com,2013:googlealerts/feed:6237816816729661682|2023-10-17T15:13:39Z|https://www.law360.ca/articles/51675/fasken-opens-office-in-alberta-first-nation-s-new-development%3Fcategory%3Dinsider
en|" flood | ""ice jam"" + Ontario"|Ontario|Good Greens initiative aims to reduce food waste and provide healthy food downtown|An <b>Ontario</b> Provincial Police officer faces criminal charges following allegations she broke into her former boyfriend&#39;s home and assaulted his&nbsp;...|tag:google.com,2013:googlealerts/feed:4846231476456559901|2023-10-18T06:19:47Z|https://windsor.ctvnews.ca/good-greens-initiative-aims-to-reduce-food-waste-and-provide-healthy-food-downtown-1.6605292
en|" flood | ""ice jam"" + Ontario"|Ontario|Company run by N.S. contractor fined $17K in <b>Ontario</b> engineering case - MSN|... <b>Ontario</b> judge for ... Is Montreal&#39;s Olympic Stadium worth saving? Localized <b>flood</b> threat as spiraling system brings days of rain to East Coast.|tag:google.com,2013:googlealerts/feed:14525904363871309671|2023-10-18T05:44:07Z|https://www.msn.com/en-ca/news/canada/company-run-by-n-s-contractor-fined-17k-in-ontario-engineering-case/ar-AA1iniW7
en|" flood | ""ice jam"" + Ontario"|Ontario|Sault&#39;s pumpkin paddler grateful for &#39;cool adventure&#39; - Sudbury News|Should the <b>Ontario</b> sexual education curriculum include instruction on sexual orientation and gender identity? Yes, absolutely. No, that&#39;s the job of&nbsp;...|tag:google.com,2013:googlealerts/feed:12833179933887538473|2023-10-18T01:02:34Z|https://www.sudbury.com/around-the-north/saults-pumpkin-paddler-grateful-for-cool-adventure-7693995
en|" flood | ""ice jam"" + Ontario"|Ontario|"Stolen big rig leads OPP on pursuit | CityNews Ottawa"|Stolen big rig leads OPP on pursuit. OPP. <b>Ontario</b> Provincial Police (OPP) logo. ... <b>Flood</b> of felines has Ottawa Humane Society looking for foster homes.|tag:google.com,2013:googlealerts/feed:5857391185559335833|2023-10-17T21:01:31Z|https://ottawa.citynews.ca/2023/10/17/stolen-big-rig-leads-opp-on-pursuit/
en|" flood | ""ice jam"" + Ontario"|Ontario|Etobicoke house beats fall&#39;s <b>flood</b> of listings, gets seven offers - The Globe and Mail|This 1½-storey house was opened to potential buyers during the second last week of August to avoid getting lost in the <b>flood</b> of properties that&nbsp;...|tag:google.com,2013:googlealerts/feed:3660814600897247235|2023-10-17T21:01:02Z|https://www.theglobeandmail.com/real-estate/toronto/article-etobicoke-house-beats-falls-flood-of-listings-gets-seven-offers/
en|" flood | ""ice jam"" + Ontario"|Ontario|Death threats, expletives: Palestinian business owners in US and Canada endure hate, grief|The co-director of an <b>Ontario</b>, California-based clothing company -- which sells traditional garments to Palestinians for special occasions -- said&nbsp;...|tag:google.com,2013:googlealerts/feed:17850500214319543920|2023-10-17T20:25:13Z|https://abcnews.go.com/Business/death-threats-expletives-palestinian-business-owners-us-canada/story%3Fid%3D104006583
en|" flood | ""ice jam"" + Ontario"|Ontario|<b>Flood</b> of felines has humane society looking for foster homes - CityNews Ottawa|... <b>flood</b> of cats arriving at the Ottawa Humane Society in the past few days. ... Ottawa, <b>Ontario</b>, K1G 6C9 © 2006 - 2023 Rogers Media. All rights reserved&nbsp;...|tag:google.com,2013:googlealerts/feed:3543623000840668220|2023-10-17T19:21:57Z|https://ottawa.citynews.ca/2023/10/17/flood-of-felines-has-humane-society-looking-for-foster-homes/
en|" flood | ""ice jam"" + Ontario"|Ontario|Summer storms bring Cat damages past $3 billion - Canadian Underwriter|<b>Ontario</b> summer storms. Summer storms and flash floods that hit parts of <b>Ontario</b> ... Devil in the details: Canada&#39;s proposed <b>flood</b> program &middot; Contact Us&nbsp;...|tag:google.com,2013:googlealerts/feed:1452038503394068949|2023-10-17T14:48:15Z|https://www.canadianunderwriter.ca/catastrophes/summer-storms-bring-total-cat-damages-past-3-billion-1004239109/
en|" flood | ""ice jam"" + Ontario"|Ontario|"Owl&#39;s Produce <b>flood</b> damages | | themountaineer.com"|SINKING FEELING — Owner of Owl&#39;s Produce, Chris Arrowood, watched a decade of work he put into his families produce stand &quot;go down the drain&quot;&nbsp;...|tag:google.com,2013:googlealerts/feed:16584540129628565446|2023-10-17T14:44:42Z|https://www.themountaineer.com/owls-produce-flood-damages/image_2bf6f978-6cfa-11ee-824d-775a6c7765dd.html
en|" flood | ""ice jam"" + Ontario"|Ontario|NOHFC announces economic development funding in Kenora - NWONewsWatch.com|The Northern <b>Ontario</b> Heritage Fund Corporation provides funding to help boost tourism and expand local business operations.|tag:google.com,2013:googlealerts/feed:8382559287099165971|2023-10-17T14:02:55Z|https://www.nwonewswatch.com/local-news/nohfc-announces-economic-development-funding-in-kenora-7664010
en|" flood | ""ice jam"" + Ontario"|Ontario|Greta Thunberg joins activists to disrupt oil executives&#39; forum in London - CityNews Toronto|Our hopes and dreams and lives are being washed away by a <b>flood</b> of greenwashing and lies,” Thunberg said. ... <b>Ontario</b>-wide carjacking task force to be&nbsp;...|tag:google.com,2013:googlealerts/feed:13990475167564494235|2023-10-17T13:45:49Z|https://toronto.citynews.ca/2023/10/17/greta-thunberg-joins-activists-to-disrupt-oil-executives-forum-in-london/
en|" flood | ""ice jam"" + Ontario"|Ontario|Storm Babet: Amber rain warning issued for eastern Scotland - Yahoo News Canada|Network Rail Scotland said it was holding meetings to assess the potential impact. Storm Babet warnings for <b>flood</b>-hit areas of Scotland. The Met&nbsp;...|tag:google.com,2013:googlealerts/feed:14697849107473085343|2023-10-17T12:04:07Z|https://ca.news.yahoo.com/storm-babet-amber-rain-warning-115454589.html
en|" flood | ""ice jam"" + Ontario"|Ontario|"Four riverfront projects in Ogdensburg are now complete | NCPR News"|The city received more than $8 million from the state to complete four <b>flood</b> resiliency projects. It includes fixing up the marina and city dock.|tag:google.com,2013:googlealerts/feed:7777149566387344504|2023-10-17T12:02:09Z|https://www.northcountrypublicradio.org/news/story/48625/20231017/four-riverfront-projects-in-ogdensburg-are-now-complete
en|" flood | ""ice jam"" + Ontario"|Ontario|Revealed – how much <b>Ontario&#39;s</b> summer storms cost the insurance industry|Catastrophe &amp; <b>Flood</b> ... The severe storms and flash floods that wreaked havoc across <b>Ontario</b> this past summer resulted in insured losses surpassing $340&nbsp;...|tag:google.com,2013:googlealerts/feed:2574094645059510103|2023-10-17T10:33:30Z|https://www.insurancebusinessmag.com/ca/news/catastrophe/revealed--how-much-ontarios-summer-storms-cost-the-insurance-industry-463373.aspx
en|" flood | ""ice jam"" + Ontario"|Ontario|Library in Canada&#39;s <b>Ontario</b> Apologizes for Islamophobic Email|OTTAWA (IQNA) – After an employee email posted online that suggested Markham Public Library in <b>Ontario</b> ... Al-Aqsa <b>Flood</b> Operation &#39;Natural Response&#39; to&nbsp;...|tag:google.com,2013:googlealerts/feed:7131308615393539840|2023-10-17T10:25:50Z|https://iqna.ir/en/news/3485622/library-in-canada%25E2%2580%2599s-ontario-apologizes-for-islamophobic-email
en|" flood | ""ice jam"" + Ontario"|Ontario|Court dismisses appeal in case where company brought actions against in-house counsel|The Court of Appeal for <b>Ontario</b> has dismissed an appeal in a case where an ... Queens University Law Dean Colleen <b>Flood</b> Law schools disclose common&nbsp;...|tag:google.com,2013:googlealerts/feed:6905937310133480465|2023-10-17T08:12:47Z|https://www.law360.ca/articles/51687/court-dismisses-appeal-in-case-where-company-brought-actions-against-in-house-counsel
en|" flood | ""ice jam"" + Yukon"|Yukon|&#39;We are still hopeful,&#39; says RCMP on search for missing Elder in Old Crow, <b>Yukon</b>|... <b>Yukon</b> Search and Rescue. RCMP Staff Sergeant Kent Langley is helping ... <b>Flood</b>, power outage risk rises in B.C. as potent fall storm pushes in. 5&nbsp;...|tag:google.com,2013:googlealerts/feed:1585555048974899087|2023-10-18T00:59:27Z|https://ca.news.yahoo.com/still-hopeful-says-rcmp-search-005143826.html
fr|" inondation | embacle + ""Nouveau Brunswick"""|Nouveau-Brunswick|"L&#39;indice des prix à la consommation diminue | Radio-Canada Info"|L&#39;indice des prix à la consommation s&#39;établit à 3,3 % en septembre, des victimes d&#39;<b>inondations</b> ... <b>Nouveau</b>-<b>Brunswick</b>. Hier Le téléjournal avec Céline&nbsp;...|tag:google.com,2013:googlealerts/feed:1887769852845163379|2023-10-18T07:56:38Z|https://ici.radio-canada.ca/info/videos/1-8838999/indice-prix-a-consommation-diminue
fr|" inondation | embacle + ""Nouveau Brunswick"""|Nouveau-Brunswick|La réserve ornithologique Inglewood se renouvelle en restaurant les habitats de la faune|La Ville estime que les <b>inondations</b> de 2013 ont altéré le parc, y compris la lagune vieille de 100 ans, les points de sortie d&#39;eau et les canaux de&nbsp;...|tag:google.com,2013:googlealerts/feed:9749133662691411445|2023-10-17T12:41:19Z|https://ici.radio-canada.ca/nouvelle/2018578/reserve-oiseaux-inondation-calgary-inglewood
fr|" inondation | embacle + Québec"|Québec|Réaménagement urbain : Beauceville reçoit 400 000$ - Cool Fm|... <b>inondations</b>. L&#39;aide s&#39;inscrit dans la foulée de l&#39;accompagnement offert par le Bureau de projets de la rivière Chaudière mis en place par <b>Québec</b>.|tag:google.com,2013:googlealerts/feed:13385921914332180419|2023-10-17T21:00:30Z|https://www.coolfm.biz/nouvelle/11673-reamenagement-urbain-beauceville-recoit-400-000%24
fr|" inondation | embacle + Québec"|Québec|Les raisons des <b>inondations</b> du 7 octobre - Les Versants|L&#39;accès à la bretelle de la montée des Promenades, qui permet de rejoindre l&#39;autoroute 30 Est et la route 116, a été fermé par la Sûreté du <b>Québec</b> (SQ)&nbsp;...|tag:google.com,2013:googlealerts/feed:1157284402915934010|2023-10-17T20:53:00Z|https://www.versants.com/actualite/les-raisons-des-inondations-du-7-octobre/
fr|" inondation | embacle + Québec"|Québec|Victime de quatre <b>inondations</b> depuis mai: le camping du Genévrier à Baie-Saint-Paul veut survivre|... <b>Québec</b> &middot; Canada &middot; États-Unis &middot; Mexique et Caraïbes &middot; Europe &middot; Conseils &middot; Tout ... «L&#39;<b>inondation</b> du 1er mai a eu un impact sur notre moral. Nous sommes&nbsp;...|tag:google.com,2013:googlealerts/feed:17527316045815805409|2023-10-17T20:21:07Z|https://www.journaldemontreal.com/2023/10/17/le-camping-du-genevrier-veut-survivre
fr|" inondation | embacle + Québec"|Québec|<b>Inondations</b> en Thaïlande: cinq morts, de nouvelles pluies attendues|<b>Inondations</b> en Thaïlande: cinq morts, de nouvelles pluies ... Quel salaire gagne une adjointe administrative ou un adjoint administratif au <b>Québec</b>?|tag:google.com,2013:googlealerts/feed:4179582069105640346|2023-10-17T18:54:52Z|https://www.tvanouvelles.ca/2023/10/17/inondations-en-thailande-cinq-morts-de-nouvelles-pluies-attendues
fr|" inondation | embacle + Québec"|Québec|Les changements climatiques nuisent à la chaîne d&#39;approvisionnement des PME du <b>Québec</b>|Feux de forêt d&#39;une ampleur jamais vue, tempêtes destructrices, <b>inondations</b>, dômes de chaleur : les phénomènes météorologiques extrêmes ont nui à&nbsp;...|tag:google.com,2013:googlealerts/feed:15971630311181147580|2023-10-17T18:48:18Z|https://www.transportroutier.ca/nouvelles/les-changements-climatiques-nuisent-a-la-chaine-dapprovisionnement-des-pme-du-quebec/
